<?xml version="1.0" encoding="UTF-8"?>
<opensftp-config xmlns="http://opensftp.sf.net/opensftp-config"
	xmlns:xsi="http://www.w3.org/2001/XMLSchema-instance"
	xsi:schemaLocation="http://opensftp.sf.net/opensftp-config opensftp-config.xsd ">
	<sftputil-impl type="net.sf.opensftp.impl.SftpUtil">
		<property-ref name="prompter" type="net.sf.opensftp.impl.SwingPrompter"
			ref="swingPrompter" />
	</sftputil-impl>
	<interceptors>
		<interceptor name="loggingInterceptor"
			type="net.sf.opensftp.interceptor.LoggingInterceptor" />
		<interceptor name="dummyInterceptor"
			type="net.sf.opensftp.interceptor.DummyInterceptor">
			<property name="dummyfield1" type="java.lang.String" value="value1" />
			<property name="dummyfield2" type="java.lang.Integer" value="2" />
			<property-ref name="dummyfield3" type="java.util.HashMap"
				ref="dummyMap" />
			<property-ref name="dummyfield4" type="java.util.Date"
				ref="dummyDate" />
			<property-ref name="dummyfield5" type="java.text.DateFormat"
				ref="dummyDateFormat" />
		</interceptor>
	</interceptors>
	<beans>
		<bean name="swingPrompter" type="net.sf.opensftp.impl.SwingPrompter" />
		<bean name="dummyMap" type="java.util.HashMap">
			<initializing-block>put("1","one");put("2","two");put("5","five");</initializing-block>
		</bean>
		<bean name="dummyDate" type="java.util.Date">
			<property name="hours" type="java.lang.Integer" value="17" />
			<property name="minutes" type="java.lang.Integer" value="30" />
			<initializing-block>setSeconds(40);</initializing-block>
		</bean>
		<bean name="dummyDateFormat" type="java.text.SimpleDateFormat">
			<property-ref name="calendar" type="java.util.Calendar"
				ref="dummyCalendar" />
		</bean>
		<bean name="dummyCalendar" type="java.util.GregorianCalendar">
			<property-ref name="time" type="java.util.Date" ref="dummyDate2" />
		</bean>
		<bean name="dummyDate2" type="java.util.Date" />
	</beans>
</opensftp-config>
