<?xml version="1.0" encoding="UTF-8"?>
<opensftp-config xmlns="http://opensftp.sf.net/opensftp-config"
	xmlns:xsi="http://www.w3.org/2001/XMLSchema-instance"
	xsi:schemaLocation="http://opensftp.sf.net/opensftp-config opensftp-config.xsd ">
	<sftputil-impl type="net.sf.opensftp.impl.SftpUtil">
		<property-ref name="prompter" type="net.sf.opensftp.prompter.Prompter"
			ref="swingPrompter" />
		<property-ref name="progressListener" type="net.sf.opensftp.ProgressListener"
			ref="plainProgressListener" />
	</sftputil-impl>
	<interceptors>
		<interceptor name="loggingInterceptor"
			type="net.sf.opensftp.interceptor.LoggingInterceptor">
			<property name="logCommand" type="java.lang.Boolean" value="true" />
		</interceptor>
	</interceptors>
	<beans>
		<bean name="swingPrompter" type="net.sf.opensftp.prompter.SwingPrompter" />
		<bean name="plainProgressListener" type="net.sf.opensftp.impl.PlainProgressListener" />
	</beans>
</opensftp-config>
